{
  "version": 1,
  "scope": {
    "environment": "test",
    "tenantId": "tenant-example",
    "draftId": "draft-example",
    "domain": "example.com"
  },
  "adminAccess": {
    "mode": "auth-profile",
    "authProfileId": "staff",
    "capabilities": [
      "integration:read",
      "integration:manage"
    ]
  },
  "bindings": [
    {
      "id": "stripe-primary",
      "provider": "stripe",
      "adapterVersion": "v1",
      "connectionId": "stripe-primary",
      "status": "active",
      "mode": "test",
      "capabilities": [
        "connect-onboarding",
        "checkout",
        "one-time-payments",
        "subscriptions",
        "prices",
        "coupons",
        "customer-portal"
      ],
      "stripe": {
        "accountStrategy": "oauth-standard-v1",
        "accountModel": "merchant",
        "chargeType": "direct",
        "feePayer": "connected-account",
        "taxMode": "unconfigured",
        "platformFeeMode": "disabled",
        "webhookIngress": "direct-integrations-api",
        "customerPortalReturnPath": "/admin/suscripcion",
        "onboardingRoutes": {
          "returnPath": "/admin/integrations/stripe/return",
          "refreshPath": "/admin/integrations/stripe/refresh"
        }
      }
    }
  ]
}
